{
  "curve": [
    {
      "first_timestamp_ms": 1783810926799,
      "last_timestamp_ms": 1783810926810,
      "prevented_tokens_total": 0,
      "raw_tokens_total": 796,
      "saved_bytes_total": 0,
      "sessions_n": 1,
      "turns_n": 2,
      "version": "1.2.0",
      "visible_cost_tokens": {
        "max_per_session": 423,
        "mean_per_session": 423.0,
        "median_per_session": 423.0,
        "min_per_session": 423,
        "total": 423
      }
    }
  ],
  "generated_from_latest_record_at": "2026-07-11T23:02:06.810000Z",
  "losses_disclosed": [
    "Only 1 version is represented; no cross-release trend can be inferred.",
    "Only 1 session is represented; distribution statistics are thin."
  ],
  "methodology": {
    "cost": "sum of token_mass.visible_tokens for every valid ledger turn in the session",
    "integrity": "all valid records are retained; malformed and foreign-schema counts are disclosed",
    "ordering": "numeric dotted version components first, then lexical components",
    "unit": "one session is a unique (version.crate, repo, session_id) tuple"
  },
  "sample": {
    "ignored_schema_records_n": 0,
    "malformed_records_n": 0,
    "records_n": 2,
    "sessions_n": 1,
    "source_files_n": 1,
    "versions_n": 1
  },
  "schema": "tokenzero.ledger-curve.v1",
  "sessions": [
    {
      "first_timestamp_ms": 1783810926799,
      "last_timestamp_ms": 1783810926810,
      "prevented_tokens": 0,
      "raw_tokens": 796,
      "repo": "/var/folders/tw/wpjfrh5s60j_yldw1nv2k4300000gn/T/tokenzero-observatory-ujmxw8tj",
      "saved_bytes": 0,
      "session_id": "tz-62295-18c15e9637ea62c0",
      "turns": 2,
      "version": "1.2.0",
      "visible_cost_tokens": 423
    }
  ],
  "sources": [
    {
      "bytes": 988,
      "path": "/Users/aditya/AI/TokenZero/crates/tokenzero-mcp/benches/session_observatory/replayed.ledger.jsonl",
      "sha256": "fedbbf8054269505530b598c3c579b22b37ed73c865d482358c79b3d1cde6c94",
      "valid_records": 2
    }
  ]
}
